question,answer
What should you do when opening a battery compartment?,"The cab, windows, mirrors, and lights."
What should you do if the battery is corroded?,Fluid systems may be under pressure and hot.
 What should you do if battery acid gets on the skin or in the eyes?,Shut down the machine before removing the fuel tank cap.
What should you use to check the battery’s condition only with?,A:
"When disconnecting the battery, what order should you disconnect the cables in?",In a well-ventilated area.
What may not completely interrupt the electrical system?,Smoke or allow open flames.
Who is responsible for replacing damaged or missing safety decals on the machine?,Topping off the fuel tank.
What should you do before exiting the machine?,Perform repairs.
Why should you make sure all personnel are at a safe distance from the machine?,Your hands.
What should you do when working with another person on a jobsite?,Safety glasses and leather gloves
What should the operator respond to while operating the machine?,Seek medical attention immediately.
What should you do if visibility becomes blocked while operating the machine?,Cracks in the lines or hoses and swelling in the hoses.
What is required by OSHA when operating the machine with operator aids?,"Replace lines and hoses immediately if leaks, swelling, or cracking is found."
What should you check before using Personal Protective Equipment (PPE)?,An accumulator charged with high-pressure nitrogen gas.
Why is hearing protection important?,Disassemble it.
What should you confirm before operating the machine?,Over 140°F (60°C) or to open flames.
How should you travel with the machine?,Weld on it.
What should you avoid when traveling with the machine?,Strike it.
What should you do before crossing bridges or roadways with the machine?,A SANY dealer.
What should you do when traveling or operating in shallow water?,Industry approved electrical cleaners.
What precautions should you take when traveling on an incline?,"Caustic soaps, high-pressure water, or steam cleaners."
What should you avoid when operating on snow or frozen surfaces?,"Always wear personal protective equipment (PPE). Never allow smoking, sparks, or open flames around the battery."
"Why should you keep windows, mirrors, cameras, and lights clean and in good condition?", There is a risk of an explosion because battery gases are extremely explosive.
What should you do before moving the machine?,Always allow ample time for battery gases to escape.
What should you use when the view is obstructed when backing up?,Clean it with a mixture of warm water and baking soda.
Why is it important to use approved personal protective equipment (PPE) and follow environmental safety regulations?,Flush the area immediately with fresh water and seek medical attention.
"What should you consult for guidelines on PPE, handling, and cleanup of hazardous materials?",Proper test equipment.
"Why is it important to recycle used oil, coolant, and filters?","Negative (-) cable first, then the positive (+) cable."
What should you avoid when disposing of harmful items?,Disconnecting the jumper cable between the batteries.
What should you avoid when operating near overhead power lines?,The owner/operator.
How should you treat overhead power lines?,Shut down the engine.
What should you do before excavating?,"Because it's a safety precaution before starting any work operations, travel, or maintenance procedures."
What should the owner/operator do if safety decals on the machine are damaged or missing?,Make sure all personnel involved understand all industry-standard hand signals.
"When leaving the machine unattended, what should be done?","Operating signals from the proper signal person, and stop signals at any time from anyone."
How should the machine be parked?,Stop operation immediately.
"Before starting work, travel, or maintenance, what should be ensured regarding personnel?",The operator aids must be used.
Who is responsible for conducting periodic safety training and familiarizing personnel with emergency procedures?,Make sure it is in good working condition.
What should be done when pedestrians are in the area?,To protect against loud noise that can cause impairment or loss of hearing.
"When working with another person, what is important to understand?",The relative positions of the frame and operator.
What should the operator do regarding operating signals?,"In a safe, controlled manner, and remain alert at all times."
When is a signalman required?,"Traveling over obstacles or raised areas, and rapid movements on snow or frozen surfaces."
What should be done if visibility becomes blocked?,Check to make sure the area will support the weight of the machine.
 What does OSHA require regarding operator aids?,Be aware of its depth and current.
What should be done before using PPE?,"Check the firmness of the surface, travel straight up or down, avoid turning, and sudden stops."
Why is hearing protection  important?,"Rapid movements, acceleration, or quick stopping."
What should be confirmed before operating the machine?,To avoid backover accidents.
What is important to remember when traveling with the machine?,"Make sure all bystanders are clear of the intended path, and warn others with the horn."
What to do when traveling over rough ground?,A signalman.
What should be checked before traveling across bridges and roadways?,To prevent hazardous dust or chemicals from being released or mishandled.
What should be done before traveling in public areas?,The Safety Data Sheet (SDS).
What should the work equipment height be when traveling?,To conserve natural resources and reduce pollution.
What should be considered when traveling or operating in shallow water?,"Disposing of them in a way that can contaminate soil, groundwater, streams, and rivers."
Who is at risk and what can they do to better avoid back-over accidents,"Direct contact with high-voltage power lines, as it can cause equipment damage, death, or serious injury."
What precautions should be taken when operating in dust or chemical hazards?,As if they are energized and not insulated.
What document should be consulted for guidelines on dust and chemical hazards?,Make sure all underground utilities have been marked.
What can happen if oil and coolant are poured improperly?,Replace them.
What helps conserve natural resources and is good for the environment?,Never leave the machine running.
What should be done when operating near overhead power lines?,"In a safe, level area, lower any work equipment, lock the controls, and secure it to prevent tampering."
What should be done before excavating?,All personnel should be at a safe distance from all points of the machine.
What is the component labeled as number 1 in Figure 3-1?,The operator's employer.
Where is the diesel exhaust fluid (DEF) tank located on the machine?,Sound the horn and proceed slowly.
What is the component labeled as number 3 in Figure 3-1?,All personnel involved should understand all industry-standard hand signals.
What is the component labeled as number 4 in Figure 3-1?,"Respond to the signal person, but obey a stop signal from anyone."
What is the component labeled as number 5 in Figure 3-1?,When the operator cannot see the work location.
Where is the fuel tank filler cap located on the machine?,Stop operation immediately.
What is the component labeled as number 7 in Figure 3-1?, They must be used when operating the machine.
Where is the backup camera located on the machine?,Make sure it is in good working condition.
What is the component labeled as number 10 in Figure 3-1?,Prolonged exposure to loud noises can cause impairment or hearing loss.
What is the component labeled as number 12 in Figure 3-1?,The relative positions of the frame and operator.
What is the component labeled as number 13 in Figure 3-1?,"Travel in a safe, controlled manner and remain alert."
What is the component labeled as number 15 in Figure 3-1?,Travel at low speed and steer carefully; avoid obstacles and raised areas.
Where is the fuel tank filler cap located?,Whether they can support the machine's weight.
 What is located on the right side of the machine?,Gain approval from local authorities and follow their instructions.
What is the function of the bell crank?,8 inches to 12 inches above the ground.
Where is the battery compartment located?,Its depth and current.
Where is the backup camera located?," People. Remain clear of the intended path, be warned with the horn,"
What is part number 5 on the diagram?,Wear PPE and follow environmental safety regulations.
What should you inspect on the cab door?,Safety Data Sheet (SDS).
How do you secure the cab door in the open position?,Soil and water can be contaminated.
How do you close the cab door?,"Recycling used oil, coolant, and filters."
How do you open the cab door from inside the cab?,Obey all regulations.
What should you do to prevent the electrical compartment access door from closing unexpectedly?,"High-voltage electricity can discharge to the ground through the machine, even without direct contact."
How do you open the electrical compartment access door?,Stay clear. Treat all overhead power lines as if they are energized and not insulated.
What should you inspect on the electrical compartment door?, Ensure all underground utilities have been marked.
How do you open the upper engine compartment door?,Bell crank
What must you do before opening the lower engine compartment door?,Right side of the machine
How do you open the lower engine compartment door?,Boom cylinders
How do you open the DEF tank access door?,Bucket cylinder
How do you open the radiator and oil cooler access door?,"Headlights, turn signals, and horn"
What supports the radiator and oil cooler access door?,Right side of the machine
"How do you access the radiator, oil cooler, and intake air cooler?",Cab
How do you secure the battery compartment cover?,Back of the machine
What is the purpose of the battery disconnect switch?,Backup camera
When should you turn the battery disconnect switch off?,Counterweight
What should you not do with the battery disconnect switch?,Battery compartment
How do you disconnect battery power from the machine?,Fuel tank filler cap
What should you inspect on the cab door?,On the right side of the machine.
How do you secure the cab door in the open position?,The diesel exhaust fluid (DEF) tank and the fuel tank filler cap.
How do you close the cab door?, The text doesn't specify the function of the bell crank.
How do you open the cab door from inside?,On the machine .
How do you prevent the electrical compartment door from closing unexpectedly?,On the back of the machine.
What should you inspect on the electrical compartment door?," Headlights, turn signals, and horn."
How is the upper engine compartment door supported?,The cab door seal for signs of wear or damage.
What should you do before opening the lower engine compartment door?,"Press the door handle button, swing the door open, and firmly seat the door catch into the door latch."
 What two compartments can you access through the radiator and oil cooler access door?,"Push the latch down to release the door, and swing the door until it engages the door latch."
How do you secure the battery compartment cover?,Pull the door latch handle back.
What happens when you turn the battery disconnect switch to the OFF position?,Place the support rod into the bracket.
What caution should be taken when using the battery disconnect switch?,"Unlock and press the door handle button, then swing the door open."
What is the function of the accelerator pedal?,The electrical compartment door seal for signs of wear or damage.
How do you increase engine speed using the accelerator pedal?,Unlock and pull the latch.
How do you decrease engine speed using the accelerator pedal?,Open the upper engine compartment door.
Where is the front differential lock switch located?,Unlock and pull the latch.
When is the front differential lock used?,Unlock and lift the handle.
How do you engage the front differential lock?,Unlock and pull the latch.
How do you disengage the front differential lock?,Two pneumatic cylinders.
What are the left and right brake pedals used for?,Release the latch and swing the air conditioning condenser open.
Can either pedal be used to slow or stop the machine?,Install a lock through the brackets.
What happens in the case of engine failure?,To disconnect electrical power from the electrical systems.
What is displayed on the monitor on the front console?,"When securing the machine for the day, or as needed when performing service."
What is the function of the steering wheel?,Turn it off while the engine is running.
What is the steering knob used for?,"Turn the key switch to OFF, open the battery compartment door, turn the battery disconnect switch to the OFF position, and close the battery compartment door."
What is the emergency steering feature used for?,You should inspect the cab door seal for signs of wear or damage.
Where is the steering column tilt lock located?," Press the door handle button, swing the door open, and firmly seat the door catch into the door latch."
How do you position the steering wheel for operator comfort?,"Push the latch down to release the door, then swing it until it engages the door latch."
How do you secure the steering column in the desired position?,Pull the door latch handle.
Where is the transmission control lever located?,Place the support rod into the bracket.
What is the transmission control lever used for?,Inspect the electrical compartment door seal for signs of wear or damage.
How do you lock the transmission control lever in the neutral position?, It is supported by pneumatic cylinders.
What happens when the transmission control lever is in the F (forward) position and the engine is running?,Open the upper engine compartment door.
What happens when the transmission control lever is in the R (reverse) position and the engine is running?,The radiator and oil cooler.
What happens when the transmission control lever is in the N (neutral) position and the engine is running?, Install a lock through the brackets.
Can the engine be started when the transmission control lever is not in the neutral position?,Electrical power is disconnected from the electrical systems.
How do you shift gears?,Do not turn the switch off while the engine is running.
What is the forced downshifting function used for?,To adjust engine speed.
How do you operate the forced downshifting function?,Press the accelerator pedal.
What is the function of the accelerator pedal?,Release the accelerator pedal.
How do you engage the front differential lock?,On the far left on the floor of the cab.
What happens when you press either the left or right brake pedal?,"When added traction is needed for off-road operations, such as operating on gravel, mud, or snow."
What information does the monitor on the front console display?,Press and hold the switch to engage the front differential lock.
What is the purpose of the steering knob on the steering wheel?,Release the switch to disengage the front differential lock.
What is the function of the steering column tilt lock?,To apply the service brakes to slow or stop the machine.
In what direction does the machine move when the transmission control lever is moved up?,Yes.
What happens when you move the transmission control lever down?,The accumulator can provide a limited supply of pressurized hydraulic oil for emergency braking.
What needs to be true for the engine to start?,Various machine operational parameters and operating system menu screens.
How do you shift gears?,To control the machine's direction of travel.
What is the function of the kickdown (KD) button?,To provide one-hand operation when needed.
"Besides the transmission control lever, where else can you find the KD button?",To safely control and stop the machine after the engine has stopped.
What is the function of the transmission control lever on the left side of the steering column?,On the right side of the steering column behind the steering wheel.
What is the purpose of the joystick forward/reverse enable switch?,Press the steering column tilt lock down.
How do you sound the horn?,Release the steering column tilt lock.
What is the function of the kickdown (KD) button?,On the left side of the steering column behind the steering wheel.
What are the components of the right console?,"To select forward, reverse, or neutral travel."
What is the function of the park brake switch?,Using the neutral lock.
What is the function of the engine diagnostic switch?,The machine will move forward.
What is the function of the emergency stop switch?,The machine will move backward.
What is the function of the cigarette lighter socket?,The machine remains stationary.
What is the function of the quick coupler switch?,"No, the engine can only be started when both the transmission control lever and the joystick F-N-R rocker switch are in the neutral position."
What is the function of the battery discharge indicator lamp?,"By rotating the transmission control lever until the arrow on the lever points to the desired gear (1, 2, 3, or 4)."
How do you operate the right turn signal switch?,To downshift the transmission to first forward or first reverse.
What is the function of the hydraulic system lockout switch?,By pressing the kickdown (KD) button on the end of the transmission control lever or on the joystick.
What is the function of the beacon light switch?,The accelerator pedal is used to adjust engine speed.
How do you enable or disable the joystick F-N-R rocker switch?,Press and hold the front differential lock switch.
What are the positions of the key switch?,Pressing the left or right service brake pedals applies the service brakes to slow or stop the machine.
What is the function of the transmission shift selector dial?,The monitor displays various machine operational parameters and the operating system menu screens.
What is the function of the fan speed control rotary switch?,The steering knob provides one-hand operation when needed.
How do you operate the heater on/off control switch?,The steering column tilt lock allows you to adjust the steering wheel for operator comfort.
How do you adjust the armrest angle?,The machine moves forward.
How do you adjust the backrest angle?,The machine moves in reverse.
What should you do to the seat belt during machine operation?,Both the transmission control lever and the joystick F-N-R rocker switch need to be in the neutral position.
How often should the seat belt assemblies be inspected?,Rotate the transmission control lever until the arrow points to the desired gear.
What does the cigarette lighter socket provide?,The KD button downshifts the transmission to first forward (F1) or first reverse (R1).
 What color indicates when there is a fault in the charging system on the SW405K Wheel Loader?,The KD button is also located on the joystick.
How do you activate the front and rear work lights on the SW405K Wheel Loader?,"Machine direction can always be controlled by the transmission control lever, which overrides the joystick F-N-R switch."
What does the warning indicator light look like?,The switch enables or disables the joystick F-N-R rocker switch.
How do you activate the buzzer sound on the SW405K Wheel Loader?,Press the horn button on top of the joystick.
What is the function of the quick coupler switch?,The KD button selects the forced downshifting function.
What controls the airflow from outside air into the cab or recirculates the existing air inside the cab?,"The right console includes the upper switch panel, lower front switch panel, lower rear switch panel, transmission shift selector dial, key switch, and climate control panel."
How many speeds does the fan have?,The park brake switch enables or disables the park brake.
How do you adjust the angle of the seat bottom?,"When pressed, the engine diagnostic switch momentarily displays current engine faults (if any are present)."
What holds the seat belt in place when not in use and retracts it when needed?,The emergency stop switch is used to stop the engine in an emergency or if the engine cannot be stopped normally.
Where can you adjust the armrest angle on the seat?,The cigarette lighter socket provides 24V current.
What kind of switch is the heater on/off control?,"The quick coupler switch engages and disengages the quick coupler, if equipped."
How do you adjust the backrest angle on the seat?,The battery discharge indicator lamp illuminates if there is a fault in the charging system.
"What do you do if the seat belt webbing is frayed, the buckle is damaged, or the mounting hardware is loose?",Press the right turn signal switch to activate the right front and rear turn signals.
What must be turned ON for the radio to operate?,The hydraulic system lockout switch enables and disables the boom and bucket functions controlled by the joystick.
What is the function of the AS/PS button?,The beacon light switch operates the flashing beacon light mounted on the cab roof.
How long will each preset station play during the auto scan feature?,Use the joystick forward/reverse enable switch to enable or disable the joystick F-N-R rocker switch.
How do you access the bass level adjustment?,"The key switch has four positions: OFF, HEAT, ON, and START."
What function does the TIME button serve?,"The transmission shift selector dial selects one of four transmission functions: Manual, Auto, L (Low), and H (High)."
What is displayed on the LCD screen?,The fan speed control rotary switch controls the four fan speeds.
How do you turn the radio on or off?,The heater on/off control switch is a two-position rotary switch that operates the cab heater.
What happens when you press and release the power button when the radio is on?,Turn the dial to adjust the armrest angle up or down.
How do you set the volume?,"Pull the backrest adjustment lever up and move the backrest to the desired position, then release the lever to lock it in position."
What is the function of the tuning buttons?,Make sure the seat belt is always fastened during machine operation.
How do you assign a current radio station to a preset station button?,Every 500 hours.
What should you do if the radio signal received is weak or noisy?,24V current.
What is the function of the backup camera and monitor?,Yellow
What is the proximity alarm system built into the camera?,Pressing the front/rear work light switch once will illuminate the left switch LED and only turn on the front work lights. Pressing it again will illuminate both the left and right switch LEDs and turn on both the front and rear work lights.
How do you access the menu screen on the backup camera monitor?,Red
What is the function of the MODE button on the backup camera monitor?,Press the horn button on top of the joystick.
How do you change the display mode on the backup camera monitor?,"It engages and disengages the quick coupler, if equipped. Contact a SANY dealer for additional information."
What is the function of the CAM button on the backup camera monitor?,The recirculated/fresh-air control switch.
How do you access the picture screen on the backup camera monitor?,Four
What is the function of the MENU button on the picture screen?,Lift up on the bottom tilt lever.
How do you adjust the screen brightness level on the picture screen?,A recoil assembly.
What is the function of the LANGUAGE selection screen?,Turn the dial.
How do you access the MIRRORING screen?,A two-position rotary switch.
What is the function of the VIDEO OPTION screen?,Pull the backrest adjustment lever up and move the backrest to the desired position. Release the lever to lock the backrest in place.
What is the function of the OPTION screen?, Replace the seat belt immediately.
What is the purpose of the MEASUREMENT UNITS SELECTION screen?,The battery disconnect switch and the key switch.
How do you access the PARK SETUP screen?,"To begin the automatic scan feature through the preset stations, or to automatically load the preset station buttons."
What is the purpose of the INTERVAL CONFIGURATION screen?,10 seconds.
Where should the fire extinguisher be kept?,Press and hold the SRC button.
What should be done with the fire extinguisher in an emergency?,To display the local time for 5 seconds.
How often should the condition of the fire extinguisher be inspected?,"The radio band (AM or FM), the currently tuned radio station frequency, the preset station number, and the current time."
What should be done if the fire extinguisher is damaged?,"Press and release the power button to turn it on, and press and hold it to turn it off."
What should be done if the fire extinguisher has reached its expiration date?,The volume is muted.
Where is the fire extinguisher located in the cab?,Press the plus (+) or minus (–) buttons.
What is the minimum rating required for the fire extinguisher?,To search for the next available radio station frequency.
What is the warning related to breaking the rear window with the escape tool?,Press and hold any of the six preset station buttons.
What can the escape tool be used for besides breaking the rear window?,Raise the antenna on the rear of the cab.
What is the purpose of the dome light?,To display the backup camera view when on.
How is the dome light controlled?,An alert will sound if there is an object within 9.8 ft (3 m) when backing the machine.
What happens when the slide switch is moved right?,Press the MENU button.
What happens when the slide switch is moved left?,To display the mode adjustment.
What should be done with a corroded or loose fuse?,Use the + button or – button.
What should be done before replacing a fuse?,To switch between two cameras (if equipped).
What should be used to replace a fuse?,"Press the – button or + button, then press the MENU button."
What should not be used to replace a fuse?,To accept the selection.
