question,answer
What capacity does the fuel tank of the SW405K Wheel Loader have?,Engine coolants used can be any brand meeting the Deutz classification TR 0199-99-1115/5 EN.
What type of coolant is recommended for the engine of the SW405K Wheel Loader?,"No, never dilute fuels. Damage to the injection system can result, which causes the machine to operate improperly."
Is it recommended to dilute fuels in the SW405K Wheel Loader?,Always use clean EP (extreme pressure) grease when greasing the machine. Use greases designed for heavy-duty bearings and general industrial lubrication.
What type of grease is recommended for general industrial lubrication in the SW405K Wheel Loader?,Use ISO VG 46 anti-wear hydraulic oil in temperate climates.
What type of hydraulic oil is recommended for the SW405K Wheel Loader in temperate climates?,SANY recommends using diesel exhaust fluid (DEF) that meets ISO 22241-1.
What type of diesel exhaust fluid (DEF) is recommended for the SW405K Wheel Loader?,"No, do not use gasoline, kerosene, or any unapproved fuels in the fuel system."
"Is it allowed to use gasoline, kerosene, or any unapproved fuels in the fuel system of the SW405K Wheel Loader?",Have the fuel system professionally serviced.
What should be done if fuel waxing or bacteria should occur in the fuel system of the SW405K Wheel Loader?,Check the batteries.
What should be done with the machine's batteries according to the daily or every 10 hours maintenance schedule?,Fluid leaks.
What should be checked daily or every 10 hours to ensure there is no damage to the machine?,The engine exhaust system.
What should be checked daily or every 10 hours to ensure proper engine performance?,Engine coolant.
What should be checked and added if necessary every 10 hours or daily?,Battery terminals.
What should be checked weekly or every 50 hours after completing daily and 50-hour maintenance tasks?,The transmission oil and filter.
"What should be checked and changed if necessary every 100 hours after completing daily, 50-hour, and 100-hour maintenance tasks?",The primary and secondary fuel filters.
"What should be checked and replaced if necessary every 250 hours after completing daily, 50-hour, 100-hour, and 250-hour maintenance tasks?",The hydraulic pilot filter.
"What should be checked and changed if necessary every 500 hours after completing daily, 50-hour, 100-hour, 250-hour, and 500-hour maintenance tasks?",The fuel tank strainer.
"What should be checked and replaced if necessary every 1000 hours after completing daily, 50-hour, 100-hour, 250-hour, 500-hour, and 1000-hour maintenance tasks?",The secondary (safe) air filter.
"What should be checked and replaced if necessary every 2000 hours after completing daily, 50-hour, 100-hour, 250-hour, 500-hour, 1000-hour, and 2000-hour maintenance tasks?",The hydraulic oil.
What should be changed if necessary every 3000 hours after completing all required maintenance tasks up to that point?,The diesel exhaust fluid (DEF) filter.
What should be changed if necessary every 4000 hours after completing all required maintenance tasks up to that point?,Check all controls for smooth operation and make sure they return to the neutral position.
What should be done daily or every 10 hours to ensure the safety of the machine?,Check the hydraulic oil level and connections.
What should be checked every 10 hours or daily to ensure the proper functioning of the hydraulic system?,The front and rear axle oil.
What should be checked and changed if necessary every 100 hours after completing daily and 50-hour maintenance tasks?,The air conditioner compressor belt.
"What should be checked and replaced if necessary every 500 hours after completing daily, 50-hour, 100-hour, 250-hour, and 500-hour maintenance tasks?",Check the engine oil level.
What should be checked daily or every 10 hours to ensure the proper functioning of the engine?,The primary fuel filter.
What should be checked and drained if necessary every 10 hours or daily?,The sheet metal.
What should be inspected and cleaned if necessary every 10 hours or daily?,The fuel tank.
What should be checked and filled if necessary every 10 hours or daily?,Inspect the electrical system.
What should be checked daily or every 10 hours to ensure the proper functioning of the electrical system?,"Lubricate the driveshafts, articulating joints, and work equipment."
What should be checked daily or every 10 hours to ensure the proper functioning of the work equipment?,The park brake pads.
What should be checked and replaced if necessary every 100 hours after completing daily and 50-hour maintenance tasks?,The engine oil and filter.
"What should be checked and replaced if necessary every 500 hours after completing daily, 50-hour, 100-hour, 250-hour, and 500-hour maintenance tasks?",The service brakes.
"What should be checked and replaced if necessary every 250 hours after completing daily, 50-hour, 100-hour, and 250-hour maintenance tasks?",The engine crankcase breather.
"What should be checked and replaced if necessary every 500 hours after completing daily, 50-hour, 100-hour, 250-hour, and 500-hour maintenance tasks?",The engine coolant.
What should be checked every 1000 hours after completing all required maintenance tasks up to that point?,The engine valve clearance.
"What should be checked and replaced if necessary every 1000 hours after completing daily, 50-hour, 100-hour, 250-hour, 500-hour, and 1000-hour maintenance tasks?",The diesel exhaust fluid (DEF) filter.
What should be checked and replaced if necessary every 4500 hours after completing all required maintenance tasks up to that point?,The hydraulic system breather filter.
What should be checked and replaced if necessary every 3 months or 500 hours after completing all required maintenance tasks up to that point?,"The front work lights, headlights, turn signals/hazard lights, and marker lights should be checked for proper function at the front of the machine."
What should be checked for proper function at the front of the machine?,"The switch locations and functions for the lights can be found on page 3-14, under the ""Right Console"" section."
Where can the switch locations and functions for the lights be found?,The horn should be checked with the key switch ON for proper operation.
What should be checked with the key switch ON?,"The location of the horn buttons can be found on page 3-9, under the ""Cab"" section."
Where is the location of the horn buttons?,"The rear work lights, beacon light, backup lights, brake lights/taillights, and turn signals/hazard lights should be checked for proper function at the rear of the machine."
What items should be checked for proper function at the rear of the machine?,"The switch locations and functions for the rear lights can be found on page 3-14, under the ""Right Console"" section."
Where can the switch locations and functions for the rear lights be found?,"Prepare the machine for service by following the instructions in ""Maintenance Safety"" on page 2-5 of the text."
How do you prepare the machine for service?,The battery disconnect switch is located on page 3-8 of the text.
Where is the battery disconnect switch located?,"To open the left side engine compartment access doors, refer to ""Engine Compartment Access Doors"" on page 3-6 of the text."
How do you open the left side engine compartment access doors?,"The first step in checking and adding engine oil is to prepare the machine for service, turn off the battery disconnect switch, and open the left side engine compartment access doors."
What is the first step in checking and adding engine oil?,"Refer to ""Engine Oil Viscosity/Temperature Data"" on page 5-7 of the text for the recommended engine oil viscosity."
What is the recommended engine oil viscosity?,"If engine oil has been added, wait 2 minutes before rechecking the engine oil level."
What should you do if engine oil has been added?,"Before changing the engine oil and filter, prepare the machine for service, start the engine, and allow it to come up to normal operating temperature."
What should you do before changing the engine oil and filter?,Do not perform engine maintenance when the engine is hot. Hot engine oil or engine components may cause severe burns. Allow the engine to cool before performing engine maintenance.
What warning should you follow when performing engine maintenance?,Dispose of used engine oil and oil filters in compliance with all applicable environmental regulations.
What should you do with used engine oil and filters?,"Do not overfill the engine with oil, failure to observe and follow this notice could result in machine damage or improper machine operation."
What is the maximum engine oil level?,"Check for leaks, and check the engine oil level."
What should you check after starting the engine?,"Inspect the engine serpentine belt for abrasion, chunk-out, pulling, uneven rib wear, improper installation, cracking, misalignment, and gravel penetration."
What should you inspect when inspecting the engine serpentine belt?,Replace the belt if damaged.
When should you replace the engine serpentine belt?,"Check the engine serpentine belt between the idler and the crankshaft pulley, the belt deflection should be between 0.28 in.-0.30 in. (7 mm-10 mm)."
How do you check the engine serpentine belt deflection?,"The engine is equipped with an automatic belt tensioner, if the engine serpentine belt deflection is more than specified, replace the serpentine belt first, if the deflection is not resolved, replace the tensioner."
What is the purpose of the automatic belt tensioner?,"Inspect the air conditioner compressor belt for abrasion, chunk-out, pulling, uneven rib wear, improper installation, cracking, misalignment, and gravel penetration."
What should you check when inspecting the air conditioner compressor belt?,Replace the belt if damaged.
What action should you take if the air conditioner compressor belt is damaged?,The machine should be prepared for service by following the maintenance safety guidelines on page 2-5.
How should the machine be prepared for service before checking the air conditioner compressor belt tension?,"The battery disconnect switch should be turned to the OFF position, which is explained on page 3-8."
What should be done to the battery disconnect switch before checking the air conditioner compressor belt tension?,The engine compartment access doors that need to be opened are explained on page 3-6.
Which engine compartment access doors should be opened to check the air conditioner compressor belt tension?,The air conditioner compressor belt deflection should be between 0.28 in.–0.30 in (7 mm–10 mm).
What is the recommended air conditioner compressor belt deflection?,"If the deflection is not resolved, the tensioner should be replaced."
What should be done if the air conditioner compressor belt deflection is not resolved after replacing the belt?,The first step is to prepare the machine for service and turn the battery disconnect switch to the OFF position.
What should be the first step in inspecting the engine air filters?,Three latches need to be released to remove the engine air filter housing cover.
How many latches need to be released to remove the engine air filter housing cover?,"The primary air filter should be inspected for signs of damage, wear, or blockage before removing it from the housing."
What should be done before removing the primary air filter from the engine air filter housing?,Attempting to clean the air filter elements should not be done.
What should not be attempted on the air filter elements?,The air filter should be replaced as needed.
"What should be done after inspecting the secondary air filter for signs of damage, wear, or blockage?",The dust valve should be pointed downward.
What should be pointed downward when installing the primary air filter and air filter housing cover?,A SANY dealer should be contacted regarding this procedure.
Who should be contacted regarding the engine valve clearance procedure?,The inside of the air filter housing should be cleaned before removing the secondary filter element.
What should be done before removing the secondary engine air filter from the housing?,"The engine crankcase breather should be replaced after preparing the machine for service, turning the battery disconnect switch to the OFF position, and opening the left side engine compartment access doors."
What should be done if the engine crankcase breather needs to be replaced?,Two fasteners need to be removed.
How many fasteners need to be removed to pull the crankcase breather away from the engine?,Pliers can be used to squeeze the hose clamp tabs and remove the breather hose.
What tool can be used to remove the breather hose from the crankcase breather?,A new gasket should be installed onto the new crankcase breather.
What should be installed onto the new crankcase breather before installing the breather hose?,"The engine coolant level should be checked in the sight glass, and if additional coolant is required, the expansion tank filler cap should be slowly opened to release any pressure."
What should be done before opening the expansion tank filler cap to add coolant?,The engine coolant should be disposed of in accordance with all applicable environmental regulations.
What should be done with the engine coolant after the cooling system is empty?,"Compressed air should be used, but it should be kept a safe distance away to prevent cooling fin damage."
What should be used to clean the radiator and oil cooler fins?,"Compressed air can cause serious injury or death, so it should not come into contact with skin. Always wear goggles, gloves, and other personal protective equipment. Also, never direct compressed air directly into the cooling fins."
What precautions should be taken when using compressed air to clean the radiator and oil cooler fins?,The fan rotation should be changed to counterclockwise when cleaning the radiator.
In which direction should the fan rotation be changed when cleaning the radiator?,The engine should be stopped first before changing the fan direction.
What should be done before changing the fan direction during maintenance?,Counterclockwise fan rotation direction should only be used when cleaning the radiator. It should not be used for extended periods of time as it may cause damage to the machine.
What is the disadvantage of using counterclockwise fan rotation direction during maintenance?,You should use low-pressure compressed air and avoid pointing the nozzle directly at the radiator fins to prevent damage.
How should you clean the cooler fins of the SW405K Wheel Loader's engine?,"You should allow the engine to run until the air flowing out of the intake air cooler, air conditioner condenser, hydraulic oil cooler, transmission oil cooler, and the coolant radiator is clear of dust or debris."
What should you do after blowing or washing dirt and debris out of the cooler fins?,"You should be careful of fuel or fuel vapors coming into contact with hot surfaces or electrical components as it can cause a fire. Also, never service the fuel system near an open flame or while smoking, and clean up spilled fuel immediately."
What should you be careful of when filling the fuel tank of the SW405K Wheel Loader?,"You should check if the vent hole in the cap is blocked, as pressure in the fuel tank may drop if it is blocked, hindering the flow of fuel."
What should you check when inspecting the vent hole in the fuel filler cap of the SW405K Wheel Loader?,SANY recommends fully draining and refilling the fuel tank.
What should you do if you find an excessive amount of water or contaminants while draining the fuel/water separator of the SW405K Wheel Loader?,"You should make sure the key switch is in the OFF position and the batteries are disconnected. Also, always replace a fuse with one of the same capacity, never with one of a higher capacity."
What should you do before replacing a fuse in the SW405K Wheel Loader's electrical system?,The ePower fuse block is located inside the electrical cabinet on the right side of the cab.
Where is the ePower fuse block located in the SW405K Wheel Loader?,"To access the fuses in the ePower fuse block, remove the four fasteners and cover."
How can one access the fuses in the ePower fuse block?,The vehicle electrical center (VEC) fuse block is located inside the electrical cabinet on the right side of the cab.
Where is the vehicle electrical center (VEC) fuse block located in the SW405K Wheel Loader?,"To access the fuses in the vehicle electrical center (VEC) fuse block, open the hinged fuse box cover."
How can one access the fuses in the vehicle electrical center (VEC) fuse block?,The battery compartment fuse block is located inside the battery compartment at the left rear side of the machine.
Where is the battery compartment fuse block located in the SW405K Wheel Loader?,"To access the fuses in the battery compartment fuse block, remove the fuse block cover."
How can one access the fuses in the battery compartment fuse block?,"The fuse locations, circuits, and amperages for the SW405K Wheel Loader are provided in the given text, which includes fuses for various components such as the cigarette lighter, air conditioning, transmission control unit, wiper, ECU, GPS, DEF controller, NOx sensor, and more."
"What are the fuse locations, circuits, and amperages for the SW405K Wheel Loader?",The alternator should be checked every 1000 hours of service.
How often should the alternator be checked in the SW405K Wheel Loader?,"While checking the alternator, one should look for loose mounting bolts, worn or loose drive belt, worn alternator bearings, case and internal corrosion, and tightness of electrical connectors."
What should be checked while checking the alternator?,"One should check the top surfaces and all the battery connections under the red and black protective covers for signs of corrosion or dirt buildup, remove any trash, tools, parts, or debris from the battery compartment, and make sure all battery cable connections are tight."
How should one check the batteries in the SW405K Wheel Loader?,"One should wear personal protective equipment (PPE), work in a well-ventilated area, and avoid sparks or open flames while checking the batteries, as battery gases are explosive. If battery acid contacts skin or eyes, one should flush the area immediately with fresh water and seek medical attention."
What safety measures should be taken while checking the batteries?,"One should prepare the machine for service, open the battery compartment cover, turn the battery disconnect switch to the OFF position, remove the fasteners and washers, remove the hold-down cover, disconnect the black, ground (-) battery cables first, then disconnect the red, positive (+) cables, remove both batteries, clean the battery tray of any trash or other debris, install new batteries, connect the red, positive (+) cables first, connect the black, ground (-) cables, install the battery hold-down cover and secure it in place with the fasteners and washers."
What should be done if battery replacement is required in the SW405K Wheel Loader?,"To check the cab air filter, first release the latches and remove the panel from behind the cab seat. Then remove the wing nuts and bracket, and remove the cab filter from the bracket. Clean or replace the cab filter as necessary, and install everything back in reverse order of removal."
How do you check the cab air filter on a SW405K Wheel Loader OMM?,"To replace the fresh-air filter, remove the screws and the fresh-air exchanger panel. Then remove and replace the fresh-air filter, and install everything back in reverse order of removal."
How do you replace the fresh-air filter on a SW405K Wheel Loader OMM?,"To check the air conditioning operation, adjust the fan speed control dial to each setting and check the fan speed control and airflow. Turn the heater on/off control switch to the right and check if heat is present. Turn the temperature control dial to the right and check if the air temperature changes from warm to cool. Check the recirculated-air/fresh-air control switch function."
How do you check the air conditioning operation on a SW405K Wheel Loader OMM?,"Before inspecting the exhaust system, prepare the machine for service, turn the battery disconnect switch to OFF, and open the engine compartment access doors. Make sure that the engine is shut down and that the exhaust has cooled to a point where it can be touched without burning."
What should be done before inspecting the exhaust system on a SW405K Wheel Loader OMM?,Contact a SANY dealer to replace damaged or missing clamps.
What should be done before replacing damaged or missing clamps on the exhaust system of a SW405K Wheel Loader OMM?,The engine exhaust will be very hot. Make sure the machine is not in a highly combustible area.
What is the warning for standstill regeneration on a SW405K Wheel Loader OMM?,"Prepare the machine for service, start and run the engine at idle, access the Calibration and Operation screens, highlight the Standstill regeneration release option, place the transmission control lever in the neutral position, lock out the hydraulic system, highlight and confirm the Release option, wait for the regeneration to complete, and do not operate any controls while the regeneration is ongoing."
What is the procedure for standstill regeneration on a SW405K Wheel Loader OMM?,"Prepare the machine for service, turn the battery disconnect switch to the OFF position, and remove the DEF compartment cover."
What is the first step in replacing the DEF suction filter on a SW405K Wheel Loader OMM?,"Prepare the machine for service, turn the battery disconnect switch to the OFF position, and remove the DEF compartment cover. Label all hoses and note their positions before disconnecting."
What should be done before replacing the DEF pump filter on a SW405K Wheel Loader OMM?,The machine should be prepared for service by following the Maintenance Safety guidelines on page 2-5 of the manual.
How should the machine be prepared for service?,The battery disconnect switch should be turned to the OFF position before checking the hydraulic oil level.
What should be done to the battery disconnect switch before checking the hydraulic oil level?,The hydraulic oil level sight glass is located on the left side of the machine behind the cab.
What is the location of the hydraulic oil level sight glass?,Hydraulic oil should be added until the level is between the high and low level marks on the sight glass.
What should be done if the hydraulic oil level is below the low mark on the sight glass?,Hydraulic oil should not be added to a level above the high level mark on the hydraulic tank sight glass.
What should not be done when adding hydraulic oil?,"The hydraulic system pressure should be relieved, and the battery disconnect switch should be turned to the OFF position."
What should be done before removing the hydraulic tank filler cover?,The O-ring should be inspected and replaced if missing or damaged.
What should be inspected when removing the hydraulic tank filler cover?,"The battery disconnect switch should be turned to the ON position, and the engine should be started and run for 10 minutes. Then, the engine should be shut down and the hydraulic oil level should be rechecked."
What should be done after adding hydraulic oil and installing the hydraulic tank filler cover and access panel?,"The machine should be prepared for service, the battery disconnect switch should be turned to the OFF position, and all hydraulic hoses and tubes should be lowered to the ground."
What should be done before inspecting hydraulic hoses and tubes?,They should be replaced.
"What should be done if hydraulic hoses or tubes are cracked, damaged, or worn?",Thread sealant should not be used.
What should not be done when tightening loose fasteners at the ends of hydraulic hoses and tubes?,"The machine should be prepared for service, and the engine should be shut down."
What should be done before relieving hydraulic system pressure?,"The hydraulic tank breather valve wing nut should be removed, the vent button should be pressed to relieve pressure from the hydraulic tank, and the wing nut should be installed."
What should be done after relieving hydraulic system pressure?,"The machine should be prepared for service, the work equipment should be lowered to the ground, and the battery disconnect switch should be turned to the OFF position."
What should be done before changing the hydraulic oil?,"The hydraulic system pressure should be relieved, and an appropriately sized container should be placed under the hydraulic tank drain block."
What should be done before removing the hydraulic tank drain plug?,"The engine should be started, run for 10 minutes, shut down, and checked for leaks. Then, the hydraulic oil level should be rechecked."
What should be done after adding hydraulic oil to the system until the hydraulic oil level is between the low and high level marks on the sight glass?,"The air intake collars, fastener covers, fasteners, and top panel should be removed. The opening should be blocked whenever the cover is removed to prevent dirt and debris from entering the hydraulic tank."
What should be removed before replacing the hydraulic oil return filter?,You should remove four fasteners and the access panel.
What should you remove after turning the battery disconnect switch to OFF when replacing the hydraulic suction filter?,You should press down on the hydraulic tank filler cover while removing the four fasteners.
What should you do before removing the hydraulic tank filler cover?,You should replace the O-ring.
What should you replace when reinstalling the hydraulic tank filler cover?,You should relieve the hydraulic system pressure and prepare the machine for service.
