question,answer
What should you do if the engine fails to start after 15 seconds?,Only one time before initial operation.
What should you do if the engine fails to start after 5 attempts?,The home screen will appear in the display.
What maintenance should be completed before starting the engine?,The function button (1).
Where is the battery disconnect switch located?,The check mark icon (4).
What should you do when in the operator seat?,The Language Change screen.
What position should the joystick and  Forward-Neutral-Reverse (F-N-R) rocker switch be in?,By pressing the function button next to the up or down arrow icons.
What position should the transmission control lever be in?,The return arrow icon (5).
What position should the key switch be in to start the engine?," Mirrors, windows, grab handles, and steps."
What should you check immediately after the engine starts?,All trash.
"What should you do if you observe black exhaust smoke, very loud noise, or excessive vibration?",Only before initial operation.
 What should you check after the engine starts?,The home screen.
What should you do if a failure code is shown on the display screen?,Press the function button.
What precautions should be taken before battery maintenance?,"Up arrow, down arrow, and check mark icons."
What is the maximum voltage for the starting system and the battery during jump-starting?,Press the function button next to the return arrow icon.
What could happen if you use a higher voltage to jump-start the engine?, The text mentions Chinese and English systems.
What should the jumper cables and clamps be like?,"Confirm that the surrounding area is clear of personnel and obstructions, and sound the horn."
What must all machine controls be in before jump-starting?,From the operator seat.
What should you do with the jumper cables after both engines are running?,No.
What is the minimum warm-up time for the machine?,No.
What should you check after the engine runs for 5 minutes?,Carbon monoxide.
What temperature should the engine coolant reach before beginning operation?,Death or serious injury.
 What temperature should the hydraulic oil reach before beginning operation?,No more than 15 seconds.
What should you avoid during the break-in period?,Stop and allow the starter motor to cool for at least 2 minutes before attempting another start.
 What should you avoid doing during the break-in period except in an emergency?,Contact a SANY dealer.
 How long should the break-in period last?,Make sure all daily maintenance checks have been completed.
What should you do before shutting down the engine?,Turn the battery disconnect switch to ON.
What should you do before moving the transmission control lever?,Buckle the seat belt.
Why is it important to engage the park brake?,Make sure the joystick and joystick Forward-Neutral-Reverse (F-N-R) rocker switch are in N (neutral position).
What should you do after running the engine at low idle for about 5 minutes?,"Battery gases are explosive, wear personal protective equipment, and work in a well-ventilated area."
What should you do to the window and cab door after exiting the cab?,No more than 24V.
What should you do to the engine before operating the machine in cold weather?,According to the procedure outlined in steps 1-5.
What type of oil should you use in the crankcase in cold weather?,Turn the key switch to OFF or press the emergency stop switch.
What should you do to the hydraulic system in ambient temperatures below 32°F (0°C)?,"To prevent slow control response or abrupt movement during operation, which can cause serious accidents."
What precautions should you take when servicing the batteries in cold weather?,"Fuel is wasted, and carbon formation, oil dilution, lacquer or gummy deposits, and rapid accumulation of sludge in the engine occur."
Why should you fill the fuel tank to its maximum level after operation?,100 service hours.
What should you do to the undercarriage after daily operation?,Operating the machine under heavy loads or at high speeds.
What should you do before shutting down the engine?,Allow the engine to cool.
What warning should you observe when operating the machine?,All fluid levels.
What should you do before traveling?," Confirm that the surrounding area is clear of personnel and obstructions, and sound the horn."
What rules should you follow when traveling on an incline?,The operator seat.
What should you do if the engine stops on a slope?,Ether starting fluid.
What is the maximum allowable water depth for machine operation?,It is toxic and invisible and odorless.
What should you do after operating the machine in water?,Stop and allow the starter motor to cool for at least 2 minutes before attempting another start.
What should you do with the neutral lock lever before moving the transmission control lever to neutral?,Contact a SANY dealer.
What should you do in cold weather situations when operating a SANY machine?,All daily maintenance checks.
What should be done to prevent damage to the hydraulic system in cold weather?," See ""Battery Disconnect Switch"" on page 3-8."
How should you dispose of trash or debris found in the cab after daily operation?,Buckle the seat belt.
 What should you do before traveling with the machine?,Neutral position (N).
What should you do before digging?,Neutral (N)
What should you do when the machine is traveling downhill?,START
How do you load loose material with the machine?,"Black exhaust smoke, very loud noise, or excessive vibration."
How do you load hard materials or materials with greater density?,Shutdown the engine immediately by turning the key switch to OFF or by pressing the emergency stop switch and contact a SANY dealer.
What should you do to prepare a machine for long-term storage (over 30 days)?,The monitor for any failure codes.
What should you do once a month during long-term storage?,Shutdown the engine immediately and contact a SANY dealer.
What is the first step in preparing the machine for transportation?,"Work in a well-ventilated area, wear PPE, and remove metal objects from your body."
What should be done to the park brake when the loader is properly positioned on the trailer?,24V
What is the purpose of placing a support block on the trailer under the bucket?,Damage the electrical system or cause an unexpected explosion or fire.
What should be done to the transmission before shutting down the engine?,"Undamaged, free of corrosion, suitable for the battery amperage, and securely attached."
Why is it important to wait at least 1 minute before disconnecting the battery?,Neutral position.
What should be done to the mirrors before transporting the machine?,Use caution when disconnecting them. Never allow the jumper cable clamps to touch each other.
What doors should be closed and locked before transporting the machine?,5 minutes.
Why should the exhaust opening be covered during transportation?,"Black exhaust smoke, very loud noise, or excessive vibration."
How should the machine be secured in place during transportation?,176°F–212°F (80°C–100°C)
What should be done before unloading the machine from the trailer?, 122°F–158°F (50°C–70°C)
How should the access ramps be positioned during unloading?,Operating the machine under heavy loads or at high speeds.
What should be done to the mirrors after unloading the machine?,"Sudden starts, movements, or stops."
What is the first step in starting the machine after unloading?,100 service hours.
What warning should be followed when lifting the machine?,"Park the machine on a flat, level, and stable surface."
Why should no one stand close to or under a lifted machine?,Move the transmission control lever to N (neutral position) and move the neutral lock lever from drive (D) to the neutral (N) position to lock the transmission control lever in neutral and prevent unintended movement.
What is the first step in securing a SW405K Wheel Loader for transport?,To hold the machine in position and prevent unexpected machine movement.
 What should be done with the transmission before turning off the engine?,Wait for the diesel exhaust fluid (DEF) pump to stop.
Where should a support block be placed when securing the loader for transport?,Close and lock them.
What should be done before disconnecting the battery?,Preheat the engine using the key switch.
What should be done with the mirrors before securing the machine for transport?,The correct grade of oil for the current temperature range.
What should be closed and locked when securing the machine for transport?,"Start the engine and run it at low idle for 7-10 minutes, then increase the engine speed to 1000-1200 rpm and perform only no-load traveling for at least 30 minutes, or until the hydraulic oil temperature is at least 68°F (20°C)."
What should be done with the exhaust opening when securing the machine for transport?,"Wear personal protective equipment (PPE), keep the top of the battery clean, avoid smoking or exposing batteries to sparks or open flames, and avoid acid spills."
What type of block should be placed between the bucket cylinder and the trailer floor?,"To prevent moisture in the fuel tank from condensing at low temperatures, which could result in fuel-line freeze."
How should chains and wire ropes be secured when moving the machine?,"Remove mud and water, park the machine on a firm, dry surface, and open the drain valve of the fuel water separator daily."
How should the machine be unloaded?,"Move the machine to a solid, level surface, lower the bucket to the ground, and shutdown the engine."
What should be done with the access ramps after the machine is unloaded?,"Never allow personnel to be in the work area while the machine is being operated, be aware of crush points, and respond to operating signals from the signalman."
What position should the frame lock bar be in when the machine is unloaded?,"Adjust the steering wheel, make sure all sides of the machine are clear, sound the horn, adjust the bucket height, press the brake pedal, and unlock the transmission control lever."
What should you do before performing any maintenance and/or repairs?,"Always check the firmness of the inclined surface, travel straight up or down an incline, avoid turning on an incline, and avoid sudden stops."
Who should you contact if you are unable to perform the procedures listed in this manual?,Lower the bucket to the ground and restart the engine.
What should you review before performing maintenance?,2 ft. (0.6 m).
What should you avoid doing while performing maintenance?,Lubricate all lubrication points below the water line and check that no water enters the transmission or axles.
What should you do after starting the machine after maintenance or repairs?,You must move the transmission control lever to the neutral position before moving the neutral lock lever to neutral.
What should you do after performing maintenance or repairs to the machine?,"You will need to operate the machine's engine at low idle with a 7-10 minute warm-up. Then increase the engine speed to 1000-1200 rpm and perform no-load traveling for at least 30 minutes or until the hydraulic oil temperature is at least 68°F (20°C). You should use appropriate hydraulic oil, lubricants, and auxiliary items needed for below-freezing temperature operations."
Why should you use genuine SANY replacement parts?,"Follow the warm-up procedure described above. This includes running the engine at low idle for 7-10 minutes, then increasing the engine speed and traveling for at least 30 minutes, or until the hydraulic oil temperature reaches 68°F (20°C)."
What should you use when repairing or replacing machine components?, You should collect it and deposit it into a proper disposal container.
What should you avoid mixing when using lubricants?,"You need to adjust your steering wheel, ensure all sides of the machine are clear, sound the horn, adjust the bucket height, and press either brake pedal."
What should you do if the machine will be operated in below-freezing temperatures?,Use caution when operating work equipment while the machine is traveling.
What should you inspect after changing the engine or hydraulic oil or filters?,Avoid any working conditions that may cause the machine to tip over.
What should you do if contamination is found in the oil or filters?,"No, do not lift any person with the loader."
What should you do before performing any welding repairs?,Do not attempt work operations such as scraping or digging with the hydraulic cylinder fully extended.
Who should perform welding repairs on the machine?,Do not stop the engine or place the transmission in neutral when traveling downhill.
What should you avoid doing when cleaning the machine?,Contact the foreman before any digging to make sure that all underground hazards have been located.
How should you clean the machine?,Avoid moving the transmission control lever to abruptly change the direction of the machine without stopping the machine.
What should you protect when cleaning the machine?,Avoid sudden stops when lowering the boom to prevent hydraulic shock.
What should you do when servicing the machine with the covers open?,"Refer to pages 6-4, 2-2, and 2-3 for more information on technical specifications, general safety, and machine safety."
"What should you do in adverse environments such as mud, rain, or snow conditions?",Hold the steering wheel with the left hand and use the right hand to operate the joystick.
What should you do in dusty environments?,Follow the steps outlined in Figure 4-12 for loose material loading.
What should you do in cold environments?,"Move the joystick left to curl the bucket, release the joystick to allow it to return to neutral, move the joystick backward to raise the boom, and then back away from the material pile."
"What type of lubricants, coolants, and filters should be used in the SW405K Wheel Loader?","Keep the bucket in the carry position, select a speed according to the distance and road condition, and slow down while passing over a ditch or bump on the road."
What is the recommended fuel for normal operations in the SW405K Wheel Loader?,"Press the kickdown button to downshift the transmission, move the joystick backward to raise the boom and bucket, use the service brake pedal to slow and stop travel, and then move the joystick right to uncurl the bucket and dump the load."
Can No. 1 diesel fuel be used in the SW405K Wheel Loader?,Make sure all lifting devices are in safe operating condition and with sufficient capacity rating to safely support the intended load.
What is the minimum cetane level recommended by Deutz?,"Clean the machine, change the engine oil, lubricate the machine, apply grease to exposed hydraulic cylinder rods, disconnect the negative battery terminal, and close and lock all doors."
What should be done if fuel waxing or bacteria occur in the fuel system?,Open the windows and doors to provide proper ventilation and avoid gas poisoning.
What precautions should be taken to prevent fuel contamination during refueling?,Start and run the engine at low idle once a month to warm up the machine and lubricate the compressor and related parts.
What happens if fuels are diluted?,"Observe applicable laws and regulations, confirm the length, width, height, and weight capacity of the trailer, and investigate the road conditions in advance."
What is the approximate capacity of the engine oil in the SW405K Wheel Loader?,"Load the machine on firm, level ground, chock the trailer wheels, secure two access ramps of equal length parallel to the trailer, and drive slowly up the ramps and onto the trailer."
What type of grease is recommended for lubricating the machine?,Contact the foreman to make sure all underground hazards have been located.
What type of hydraulic oil is recommended for temperate climates?,Do not stop the engine or place the transmission in neutral.
What type of hydraulic oil is recommended for areas where ambient temperatures can reach -22°F (-30°C) during operation?,"1. Hold the steering wheel with the left hand and use the right hand to operate the joystick. 2. Drive toward the material with the machine in 2nd gear and the center of the bucket facing the material pile. 3. Use the joystick to lower the bucket to approximately 20 in. (508 mm) above the ground. 4. With the loader approximately 3 ft. (1 m) away from the material pile, lower the bucket until the bucket engages the ground. 5. Press the kickdown (KD) button on the transmission control lever to downshift the machine from 2nd gear to 1st gear. 6. Press the accelerator pedal as needed to push the bucket into the material. When the material stalls the forward motion, release the accelerator pedal and move the joystick left to curl the bucket. 7. Release the joystick to return to the neutral position when the bucket is loaded."
What type of diesel exhaust fluid (DEF) is recommended?," 1. Hold the steering wheel with the left hand and use the right hand to operate the joystick. 2. Drive toward the material with the center of the bucket facing the material pile and the machine in 2nd gear. 3. Use the joystick to lower the bucket to approximately 20 in. (508 mm) above the ground. 4. With the loader approximately 3 ft. (1 m) away from the material pile, lower the bucket until the bucket engages the ground. 5. Press the kickdown (KD) button on the transmission control lever to downshift the machine from 2nd gear to 1st gear. 6. Press the accelerator pedal as needed to push the bucket into the material. When the material stalls forward motion, release the accelerator pedal. 7. Move the joystick left to curl the bucket and shift the material into the bucket. 8. Move the joystick right as needed to return the bucket to the previous position. 9. Press the accelerator pedal as needed to push the bucket into the material. When the material stalls forward motion or the bucket is loaded, release the accelerator pedal and move the joystick left to curl the bucket. 10. Release the joystick to return to the neutral position when the bucket is loaded. NOTE: Repeat these steps as necessary until the desired amount of material is loaded within the bucket capacity"
What type of engine coolant is recommended?," 1. Clean the machine. 2. Change the engine oil. See ""Change the Engine Oil and Filter"" on page 5-12. 3. Lubricate the machine. See ""Recommended Lubricants, Fuel, and Engine Coolant"" on page 5-6. 4. Apply grease to any exposed hydraulic cylinder rods. 5. Disconnect the negative (–) battery terminal or remove the batteries and store them in a separate location. See ""Replace a Battery"" on page 5-28. 6. Close and lock all doors."
What type of windshield washer fluid should be used?,1. Start and run the engine at low idle. 2. Warm-up the machine to reach normal operating temperatures. 3. Drive the machine a short distance. 4. Cycle each cylinder a few times. 5. Lubricate all exposed hydraulic cylinder rods with grease. 6. Turn on the air conditioner and allow it to run for 3 to 5 minutes to lubricate the compressor and related parts. 7. Return the machine to the proper storage location and condition. 8. Shutdown the engine.
What is the maintenance schedule for the SW405K Wheel Loader?,Set the frame lock bar in the locked position.
What is the first step in securing the machine for maintenance?,Set the park brake.
Why is it important to read and understand all tasks listed in the maintenance section?,To lower the bucket onto the support block.
What is the purpose of the lockout/tagout procedure?,Set the transmission to neutral.
What daily maintenance tasks should be performed on the engine?,To allow the machine's electronic control module (ECM) to complete its updating procedures.
What should be done every 50 hours or weekly?,Position the mirrors inward toward the cab.
When should the engine oil and filter be changed?,"Electrical access door, right side engine access doors, fuel filler cap, diesel exhaust fluid (DEF) filler access door, cab door, left side engine access doors, and battery access door."
What should be done every 250 hours or monthly?,To prevent damage to the machine.
When should the transmission oil and filter be changed?,With chains or wire ropes to prevent any movement in accordance with all applicable laws and regulations.
What should be done every 500 hours or every 3 months?,"Unload the machine on firm, level ground and keep the machine a safe distance away from roads."
When should the hydraulic oil be changed?,"Parallel to the trailer, equally spaced from the centerline of the trailer, and with a mounting angle not exceeding 15°."
What should be done every 2000 hours or annually?,Position the mirrors outward and adjust for normal operation.
When should the secondary (safe) air filter be replaced?,Turn the battery disconnect switch to ON.
When should the diesel exhaust fluid (DEF) filter be replaced?,Make sure all lifting devices are in safe operating condition and with sufficient capacity rating to safely support the intended load.
What should you do before performing any maintenance on a SW405K Wheel Loader?,To prevent death or serious injury.
How often should you check the engine oil level on a SW405K Wheel Loader?,Set frame lock bar (1) in the locked position.
What should you check the engine air filters for?,Set the transmission to neutral.
What should you check the hydraulic oil level for?,Under the bucket on the trailer.
When should you perform the first change of the engine oil and filter?,Wait for at least one minute for the machine's ECM to complete its updating procedures.
 How often should you check the battery terminals?,Position the mirrors inward toward the cab.
When should you replace the primary and secondary fuel filters?,"The electrical access door, right side engine access doors, fuel filler cap, DEF filler access door, cab door, left side engine access doors, and battery access door."
What should you do every 6 months or 1000 hours?,Cover it.
 What should you do every 3000 hours?,A wood block
 What should you do every 4000 hours?,Secure them to the machine frame and prevent them from crossing or pressing against hydraulic lines or hoses.
 What should you do every 4500 hours?,"Unload it on firm, level ground, away from roads."
"What is the purpose of the section ""Lights and Warning Devices"" in the maintenance manual?"," Remove the cover from the exhaust opening and remove cab protection, if installed."
What are the items to be checked at the front of the machine?,The unlocked position.
Where can you find the switch locations and functions for the front lights?,Read and understand the Safety section of this manual before proceeding with any inspection or maintenance procedures.
How do you check the horn?,A SANY dealer.
Where can you find the location of the horn buttons?,The Maintenance Log.
What items should you check at the rear of the machine?,Working on the machine while the engine is running unless required to do so in the procedure.
Where can you find the switch locations and functions for the rear lights?,"Verify the following: if necessary, have a coworker inspect the work for correct and proper completion; complete the Maintenance Log; check for leaks in the system; verify there are no abnormal sounds coming from the engine or hydraulic system; check for any loose fasteners or abnormal movement in the system; and check for any overheating in the system."
What are the items that should be checked at the front of the machine?,"Take time to inventory tools, parts used, and fasteners to be sure none of these items were left on or inside the machine."
Where can you find information about the locations and functions of the switches for the front lights?,To avoid premature system or part failure.
How should you check the horn?,SANY-approved lubricants and coolants.
Where is the horn located?,Different lubricant brands or viscosities.
What items should be checked at the rear of the machine?,Contact a SANY dealer for assistance.
Where can you find information about the locations and functions of the switches for the rear lights?,The oil and filters for contamination.
What should you do before checking the engine oil level?,Send a sample of the oil for testing to help determine the cause and consult a SANY dealer before operating the machine.
How do you check the engine oil level?,Contact a SANY dealer.
What should the engine oil level be between?,Personnel who are qualified and certified to perform repairs that require welding.
What happens if you overfill the engine with oil?,Using caustic chemicals or steam cleaners.
When should you change the engine oil and filter?,With mild soaps and a pressure washer.
What should you do with the used engine oil filter?,Electrical parts.
How do you replace the engine oil filter element?,Make sure they are properly supported in place and close tightly and latch securely in place.
How do you inspect the engine serpentine belt?,"Inspect each connector for looseness before operating the machine, and clean the machine and inspect for missing or loose fasteners after operating the machine."
What should you do if the serpentine belt is damaged?,"Clean the engine air filter, radiator, fuel equipment, and fresh-air and recirculation filters frequently."
How do you check the engine serpentine belt tension?,"Lubricate only with recommended oils shown in ""Engine Oil Viscosity/Temperature Data"" on page 5-7."
How do you inspect the air conditioner compressor belt?,Review the Maintenance Log and ensure you understand the Safety section of the manual. Contact a SANY dealer if you are unsure about any procedures.
What should you do if the air conditioner compressor belt is damaged?,"Avoid working on the machine while the engine is running unless the procedure specifically requires it. If the engine must run, always have a person in the cab who can operate the machine correctly and maintain clear communication."
