question,answer
What does this manual provide information for?,This manual provides operation and maintenance information for the SW405K wheel loader.
What unsafe outcomes can result from improper operation or maintenance of the SW405K wheel loader?,Unsafe operation and maintenance of this machine could result in death or serious injury.
Who should operate and maintain the SW405K wheel loader?,This machine must be operated and maintained by trained and experienced personnel.
What should be done before operating or servicing the SW405K wheel loader?,Do not operate or work on this machine without first reading and understanding this operation and maintenance manual.
How often should personnel read this manual?,All personnel involved with this machine should read this manual periodically to remain knowledgeable on its operation and service.
What are some of the items addressed in this manual to help the operator or service personnel?,"The manual helps personnel understand the controls and operation of the machine, point out possible hazardous situations, increase machine efficiency, prolong the service life of the machine, and reduce maintenance costs."
Who should be contacted for the latest available information on the machine or to answer any questions regarding information in this manual?,Contact a SANY dealer for the latest available information on the machine or to answer any questions regarding information in this manual.
What does the documentation for this machine include?,"The documentation for this machine includes the Operation and Maintenance Manual, Parts Manual, and Maintenance Log."
Where should a copy of the Operation and Maintenance Manual be stored or made available?,"A copy of this manual must be stored in the machine or be accessible to the operator at all times, and a copy should be made available to maintenance personnel when servicing the machine."
What does the Parts Manual consist of?,The Parts Manual consists of parts lists and matching drawings used for ordering spare parts as needed.
Who must the Parts Manual be made available to?,The Parts Manual must be made available to all service personnel.
What is the purpose of the Maintenance Log?,"The Maintenance Log lists regularly scheduled maintenance that should be performed by the operator or service personnel, and all maintenance performed on the machine must be recorded in the maintenance log."
Should the documentation for this machine be used with any other machine?,"No, the documentation for this machine applies only to this machine and should not be used with any other machine."
What is the purpose of the overview in the first section of this manual?,"The first section of the manual provides an overview of the manual, includes serial number information, and SANY contact information."
What are hazard alerts used for in this manual?,Hazard alerts are used throughout the manual to warn users of potential dangers.
What kind of safety information is provided in this safety section?,The safety section includes both general safety information and product-specific safety information.
Where can the reader find detailed information about machine controls and operating systems?,The section on machine controls provides an overview of the controls and operating systems of the machine.
What information can be found in the machine operation section?,"The machine operation section includes detailed pre-start checks, operating procedures, end-of-day checks, general operating instructions, and storage information."
What kind of maintenance procedures and specifications can be found in the maintenance section?,The maintenance section includes routine maintenance procedures and fluid specifications for the machine.
What kind of information can be found in the specifications section of this manual?,"The specifications section includes general dimensions, weight, and systems/components performance information of the machine."
What is the primary use of the SW405K wheel loader?,The SW405K wheel loader is used primarily for transferring and loading material.
What are some of the secondary uses of the SW405K wheel loader?,"The SW405K wheel loader can be used for digging, leveling, carrying heavy loads, and removing ice and snow from road surfaces."
What kind of optional equipment can be adapted to the SW405K wheel loader?,"The SW405K wheel loader can be adapted with optional equipment such as forks, scrapers, or different bucket types."
What kind of responsibility does SANY assume for the use of the SW405K wheel loader?,SANY assumes no responsibility for any consequences caused by use outside the specified range of the machine.
What directions are used in this manual to indicate the moving direction of the machine when viewed from the operator seat?,"The front, right, back, and left directions are used in this manual to indicate the moving direction of the machine when viewed from the operator seat."
Where are product identification plates located on the SW405K Wheel Loader?,Product identification plates on the SW405K Wheel Loader are located in various places on the machine.
What information can be found on the machine identification plate?,The machine identification plate lists the model and serial numbers that will be needed by a SANY dealer when ordering replacement parts or providing assistance with the machine.
Where is the machine identification plate located on the SW405K Wheel Loader?,The machine identification plate is on the front left of the frame.
Where is the engine identification plate located on the SW405K Wheel Loader?,The engine identification plate is on the lower left side of the engine.
What is the transmission identification plate for and where is it located?,The transmission identification plate is used for identifying the transmission and it is located on the front left of the transmission.
Where is the axle identification plate located on the SW405K Wheel Loader?,The axle identification plate is located on the front left of the axle housing.
What is the company that manufactured the SW405K Wheel Loader?,SANY
"What is the address of SANY's location in Peachtree City, GA?","318 Cooper Circle, Peachtree City, GA 30269"
What is the website of SANY America?,www.sanyamerica.com
What is the phone number to contact SANY America?,470-552-SANY (7269)
How can you find a dealer for SANY products?,Go to www.sanyamerica.com/find-a-dealer
What is the purpose of the table provided in the text?,To record the product information related to the SW405K Wheel Loader machine.
What information related to the machine should be recorded in the table?,"Machine Serial Number, Engine Serial Number, Front Axle Serial Number, Rear Axle Serial Number, Transmission Serial Number, Hydraulic Pump Serial Number, Dealer Name, Dealer Address, and Dealer Phone Numbers."
What is the purpose of this form?,The purpose of this form is to report any problems found in the manual and request corrections from SANY.
What should you do if you find a problem with the manual?,"If you find a problem with the manual, you should make a copy of this page, complete the form below, and send it to SANY."
"What information should you provide in the ""Date of This Notification"" section?","In the ""Date of This Notification"" section, you should provide the date when you are making the notification of the problem."
"What is the ""Company Name"" section for?","The ""Company Name"" section is for providing the name of the company that is making the correction request."
"What is the ""Department"" section for?","The ""Department"" section is for providing the name of the department within the company that is making the correction request."
"What information should you provide in the ""Street Address"" section?","In the ""Street Address"" section, you should provide the street address of the company making the correction request."
"What information should you provide in the ""City, State, and ZIP/Postal Code"" section?","In the ""City, State, and ZIP/Postal Code"" section, you should provide the city, state or province, and postal code or zip code of the company making the correction request."
"What is the ""Phone"" section for?","The ""Phone"" section is for providing the phone number of the company making the correction request."
"What is the ""E-mail"" section for?","The ""E-mail"" section is for providing the e-mail address of the company making the correction request."
"What information should you provide in the ""Machine Model and Serial No."" section?","In the ""Machine Model and Serial No."" section, you should provide the model and serial number of the machine related to the problem being reported."
"What should you describe in the ""Description of Problem"" section?","In the ""Description of Problem"" section, you should describe the problem you found with the manual, such as wrong information, unclear or erroneous procedure."
"What is the ""Corrective Action Taken (if any)"" section for?","The ""Corrective Action Taken (if any)"" section is for describing any corrective action you have taken to address the problem reported."
What is ANSI?,ANSI stands for American National Standards Institute.
What is CCTV?,CCTV stands for Closed-Circuit Television.
What is DEF?,DEF stands for Diesel Exhaust Fluid.
What is DPF?,DPF stands for Diesel Particulate Filter.
What is DVR?,DVR stands for Digital Video Recorder.
What is EAT?,EAT stands for Exhaust After Treatment.
What is ECM?,ECM stands for Engine Control Module.
What is GPS?,GPS stands for Global Positioning System.
What is HEST?,HEST stands for High Exhaust System Temperatures.
What is ISO?,ISO stands for International Organization for Standardization.
What is KD?,KD stands for Kickdown.
What is LCD?,LCD stands for Liquid Crystal Display.
What is OEM?,OEM stands for Original Equipment Manufacturer.
What is OSHA?,"OSHA stands for Occupational Safety and Health Administration. It is mentioned twice in the text, so I assumed you wanted two questions for it."
What is PPE?,PPE stands for Personal Protective Equipment.
What is PQR?,PQR stands for Procedure Qualification Report.
What is ROPS?,ROPS stands for Rollover Protective Structure.
What is SAE?,SAE stands for Society of Automotive Engineers.
What is SCA?,SCA stands for Supplemental Coolant Additive.
What is SCR?,SCR stands for Selective Catalytic Reduction.
What is SDS?,SDS stands for Safety Data Sheet.
What is WPS?,WPS stands for Weld Procedure Specification.
What are the four signal words used in this manual to identify the degree of consequence of hazards?,"DANGER, WARNING, CAUTION, and NOTICE."
"What does the signal word ""DANGER"" indicate?","A hazardous situation which, if not avoided, will result in death or serious injury."
Who is permitted to operate and/or work on the SW405K Wheel Loader?,Only qualified personnel who have been specifically trained on this machine are permitted to operate and/or work on it.
Why should the operator wear a seat belt at all times while operating the SW405K Wheel Loader?,To ensure safety in the event of a machine malfunction or accident.
What are operator aids designed to do on the SW405K Wheel Loader?,"Operator aids such as warning lights, horns, or buzzers, along with displays on the monitors, are designed to alert the operator to potential problems."
What should the operator do if any operator aid is not working properly on the SW405K Wheel Loader?,Stop all work immediately and report the fault to a SANY dealer.
What should the operator do with this manual before operating the SW405K Wheel Loader?,Read and understand this manual and any accompanying manuals before operating this machine.
Who should be familiar with the safe operating practices stated in this manual?,All personnel in the working area around the machine.
What should the operator check before the start of each workday shift?,The maintenance log to make sure routine maintenance has been performed as stated in this manual.
Who should be on the machine while it is in operation?,Only the operator.
What should be done with the bucket or work equipment when not in use on the SW405K Wheel Loader?,Lower it to the ground.
What should be done before excavating with the SW405K Wheel Loader?,Ensure that all underground utilities have been marked.
What should you do before entering or exiting a SW405K wheel loader?,"You should ensure that the machine is at a complete stop, work equipment is lowered to the ground, engine is shut down, and never jump on or off the machine."
How should you enter or exit the cab of the SW405K wheel loader?,"You should always use the provided grab handles and steps, and face the machine while mounting and dismounting."
What should you maintain while entering or exiting the SW405K wheel loader?,"You should always maintain three-point contact (both feet and one hand, or one foot and both hands) with the grab handles, steps, and deck for proper support."
What type of footwear should be worn when operating the SW405K wheel loader?,Safety shoes with slip-resistant soles should be worn.
What should you avoid when walking on the SW405K wheel loader?,"You should avoid walking on any surface of the machine if its slip-resistant material is missing or excessively worn. You should also not step on surfaces of the machine that are not approved for walking or working. Keep all walking and working surfaces of the machine clean, dry, and slip-resistant."
What should you keep clear and clean on the SW405K wheel loader?,"You should always keep grab handle, steps, and walkway areas clean and clear of mud, oil, grease, or similar debris. If these areas are damaged, have them repaired or replaced immediately."
What is the SW405K wheel loader primarily used for?,"The SW405K wheel loader is used primarily for digging or loading. It can also remove ice and snow from road surfaces, and work on slopes and ditching."
What responsibility does SANY assume for unauthorized use of the SW405K wheel loader?,SANY assumes no responsibility for any consequence caused by use outside this specified range.
What are some examples of unauthorized use of the SW405K wheel loader?,"Unauthorized uses include, but are not limited to, transporting people on the machine or in the cab and overloading the machine beyond its capacity."
What should you avoid doing to the SW405K wheel loader?,You should not perform any unauthorized machine modifications.
What should you periodically inspect on the SW405K wheel loader?,"You should inspect the escape tool periodically, replacing it if it appears damaged or unable to break the cab window for emergency exit."
"What safety measures should you observe regarding fuel, oil, and engine coolants on the SW405K wheel loader?","You should check the machine daily for debris buildup, keep open flames, airborne sparks, and burning embers away from the machine, shut down the engine and do not smoke when refueling or servicing the machine, add oil, fuel, or engine coolant in a well-ventilated area, and clean up any spilled fluids immediately."
What can cause electrical fires on the SW405K wheel loader?,"Short circuits, damaged wiring, or overcharging batteries can cause fires."
What should you do regarding the fire extinguisher on the SW405K wheel loader?,"You should always keep the fire extinguisher in the cab, inspect its condition daily, and make sure it is within the listed inspection period. The fire extinguisher must be at least a 2.5 lb. Class ABC rated fire extinguisher (National Fire Protection Association [NFPA] 10 Standard for Portable Fire Extinguishers)."
What should you do in case of fire on the SW405K wheel loader?,"You should immediately press the emergency stop to shut down the machine, get clear of the machine and immediately call for help, exit the area and remain clear of the machine until the fire response team gives permission to come near the machine, and if using a fire extinguisher, always aim the extinguisher nozzle at the base of the fire."
What should you avoid during operation or travel of the SW405K wheel loader?,"You should keep arms, hands, and body inside the windows and door during operation or travel and keep all guards in place on the machine. You should never remove the side window of the machine. If this window becomes damaged or broken, replace it immediately."
What should you do regarding the area where the SW405K wheel loader is being operated?,You should block off the area where the machine is being operated and keep all unnecessary personnel out of the work area.
What warning does diesel engine exhaust of the SW405K wheel loader pose in California?,"Diesel engine exhaust and some of its constituents are known to the State of California to cause cancer, birth defects, and other reproductive harm."
What safety measures should you observe regarding diesel engine exhaust of the SW405K wheel loader?,"You should use an exhaust pipe extension to vent the exhaust to the outdoors if it is necessary to run an engine in an enclosed area, and open doors and use fans to supply fresh air to the area."
What should you ensure regarding machine decals on the SW405K wheel loader?,"All safety and warning decals must be in place, undamaged, and visible. You should become familiar with the location and content of all decals on the machine, and contact a SANY dealer for replacement decals if needed."
What precautions should be taken before performing any maintenance or repairs on the machine?,"Park the machine on a hard, level surface, lower the work equipment, shut down the engine, and block the wheels to prevent the machine from moving. Always perform the lockout/tagout procedure before servicing the machine and inform fellow workers before starting any step of the operation."
What personal protective equipment should be worn when carrying out operations or maintenance on the machine?,"The proper personal protective equipment (PPE) includes safety shoes, a hard hat, gloves, and goggles."
What should be done before disconnecting or removing components of the hydraulic system?,Relieve the system pressure to prevent fluids from spraying out. See “Relieve Hydraulic System Pressure” on page 5-36.
What precautions should be taken when adding fluids to the machine?,Be aware that fluid systems may be under pressure and hot.
What should be done when refueling the machine?,"Shut down the machine before removing the fuel tank cap, refuel only in a well-ventilated area, never smoke or allow open flames nearby while refueling the machine, and do not top off fuel tank."
What precautions should be taken when working with high-pressure fluid lines?,"Never perform repairs to items while any system is under pressure, never use hands to check or feel for leaks, and always wear safety glasses and leather gloves. Use a piece of wood or cardboard to check for leaks."
What should be done if high-pressure fluids penetrate skin?,Seek medical attention immediately.
What should be done when cleaning the machine?,"Always use hot water and mild, nonflammable, grease-cutting soaps or cleaning agents to clean the machine. Never use flammable or caustic cleaning agents."
What precautions should be taken when working with the electrical system?,"Clean the electrical system using industry approved electrical cleaners. Contact a SANY dealer for more information on approved products. Never use caustic soaps, high-pressure water, or steam cleaners to clean the electrical system."
What precautions should be taken when working with batteries?,"Always work in a well-ventilated area, always wear personal protective equipment (PPE), and be aware of battery gases which are extremely explosive."
What is the correct order for disconnecting the battery cables?,"Always disconnect the negative (-) cable first, then disconnect the positive (+) cable."
Who is responsible for replacing damaged or missing safety decals on the SW405K Wheel Loader?,The owner or operator is responsible for replacing damaged or missing safety decals on the SW405K Wheel Loader.
Is it allowed to leave the machine running while it is unattended?,"No, it is not allowed to leave the machine running while it is unattended."
What should be done before exiting the machine to prevent tampering by unauthorized personnel?,"The machine should be parked in a safe, level area, lower any work equipment to the ground, lock the controls, and secure the machine to prevent tampering by unauthorized personnel before exiting."
Who is responsible for conducting periodic safety training and familiarizing all personnel with emergency procedures?,The operator’s employer is responsible for conducting periodic safety training and familiarizing all personnel with emergency procedures.
What should be done if pedestrians are in the area while operating the machine?,"If pedestrians are in the area, sound the horn and proceed slowly."
What should be done when working with another person on a jobsite to ensure safety?,Make sure that all personnel involved understand all industry-standard hand signals that are to be used.
Should the operator respond to operating signals from anyone or only from the proper signal person?,The operator must only respond to operating signals from the proper signal person.
What should be done if visibility becomes blocked for any reason while operating the machine?,Stop operation immediately if visibility becomes blocked for any reason.
Are operator aids required to be used when operating the machine by OSHA?,"Yes, if the machine is equipped with operator aids, OSHA requires this equipment to be used when operating the machine."
What should be done before using personal protective equipment (PPE)?,Make sure that PPE is in good working condition before using it.
What is the effect of prolonged exposure to loud noise on the hearing?,Prolonged exposure to loud noise can cause impairment or loss of hearing.
What should be confirmed before operating the machine?,Confirm the relative positions of the frame and operator before operating the machine.
What precautions should be taken while traveling with the machine?,"Always travel in a safe, controlled manner and remain alert at all times. Be sure the areas around the machine are clearly visible. When traveling over rough ground, travel at low speed and steer carefully. Whenever possible, avoid traveling over obstacles or raised areas. Traveling over obstacles or raised areas could result in loss of control or damage to the machine."
What should be maintained during travel?,"During travel, always maintain a safe distance from people and surrounding objects."
What should be checked before traveling in public areas?,Always check to make sure areas such as bridges and roadways will support the weight of the machine before attempting to cross.
"What should be done with oil, coolant, and filters after use?","Recycling used oil, coolant, and filters helps conserve natural resources and is good for the environment. Obey all regulations when disposing of harmful items such as oil, fuel, filters, batteries, hydraulic oil, and used parts."
What should be avoided when operating the machine in high-voltage areas?,"Avoid direct contact with high-voltage power lines while operating. High-voltage contact could result in equipment damage, death, or serious injury. Stay clear of overhead power lines. Treat all overhead power lines as being energized and not insulated. Be sure all underground utilities have been marked before excavating."
"What can contaminate and pollute soil, groundwater, streams, and rivers if mishandled?","Oil and coolant poured onto the ground, into bodies of water, into storm drains, or tossed into trash cans (even in a sealed container) can contaminate and pollute soil, groundwater, streams, and rivers."
What is the component located at the number 1 in the figure 3-1?,The boom is located at the number 1 in the figure 3-1.
Where is the diesel exhaust fluid (DEF) tank of the machine?,The diesel exhaust fluid (DEF) tank is located on the right side of the machine (number 11).
What is the component located at the number 2 in the figure 3-1?,The boom cylinders is located at the number 2 in the figure 3-1.
Where is the counterweight of the machine located?,The counterweight is located at the number 12.
Which component is located at the number 3 in the figure 3-1?,The bucket is located at the number 3 in the figure 3-1.
Where is the hydraulic oil tank on the machine?,The hydraulic oil tank is located at the number 8 in the figure 3-1.
Which number is corresponding to the battery compartment location on the machine?,The battery compartment is located at the number 13.
What is the location of the fuel tank filler cap on the machine?,"The fuel tank filler cap is located on the right side of the machine, number 14."
What is located at the number 5 in the figure 3-1?,"The headlights, turn signals, and horn are located at the number 5 in the figure 3-1."
Where is the rear tire and wheel of the machine located?,The rear tire and wheel is located at the number 15.
What component corresponds to the number 16 in the figure 3-1?,The rear frame corresponds to the number 16 in the figure 3-1.
Where is the bucket of the machine located?,The bucket is located at the number 20 in the figure 3-1.
What number is corresponding to the articulation joint of the machine?,The articulation joint is located at the number 9.
Where is the engine compartment of the machine located?,The engine compartment is located at the number 13.
What is located at the number 17 in the figure 3-1?,The steps are located at the number 17.
Where is the front tire and wheel of the machine located?,The front tire and wheel is located at the number 19.
What is located at the number 18 in the figure 3-1?,The rear frame corresponds to the number 18 in the figure 3-1.
Which component is located at the number 10 in the figure 3-1?,The backup camera is located at the number 10 in the figure 3-1.
